{
  "story": "015-resource-time-buffer",
  "branch": "015-resource-time-buffer",
  "computed_at": "2026-09-28T15:19:55.247Z",
  "phase": "C4",
  "phase_status": "PASSED",
  "gates": {
    "G1": {
      "status": "PENDING"
    },
    "G2": {
      "status": "PASSED",
      "answer_ref": "toolu_01JohJtFrsxtPvauVNso2Cp1",
      "at": "2026-09-28T06:59:06.330Z"
    },
    "G2b": {
      "status": "PENDING"
    },
    "G3": {
      "status": "PENDING"
    }
  },
  "artifacts": {
    "ac-matrix.json": "3d76f7d1225fa4660ebc6f4b8e49ccfd4a4a573ecbca285222f624f5d3ac8155",
    "baseline.json": "f647e4f06b2a1f7af71f1fa1b4d4777fa2147e0c69b6b3fc491e7cb8f6129542",
    "contract-delta.overlay.json": "aafcdc78aebc0f55832694a356705aa3a26335583d0aec8461f1fc5742de5398",
    "contract-diff.json": "e5442d70bd3dbc8af707b0cec1cd9acc3435d7d572018797b2aaaccda920f1ff",
    "contract-next.json": "433a701276108c541bac93297e953a39cbd80181bfb17675616e2211325b5414",
    "coverage-gaps.json": "bf66c6e2b15e8012b3e3662e56f859b85b371939d800aab4f6fbf4a5af5e3ceb",
    "discovery/assumptions.jsonl": "9a218b8b2a8f9a081de0704515385ba75642904cb8b24f736ffd1273c21e4891",
    "discovery/decisions.jsonl": "c9072451caf0fefa64935f24b61c9bb1912fe3164623f480b5935bcc09d91a8c",
    "discovery/facts.jsonl": "d2e2a9fb971978d02d159a1da47c9523a9172bf016d2436d4f20aeba48a17d2d",
    "discovery/questions/1.md": "924df59d27c41b99f336c5401fae57ec96e50ae012db376513e97aca70cc7350",
    "discovery/questions/2.md": "0b8bc66ff06fee5e79842e941b2ddce9fb4aa1b0617966625dde698d7042d677",
    "discovery/questions/3.md": "66737ff45382d45f9037285fd6ca99706ddcb7b2fc040987c348ab5d998f3c03",
    "discovery/questions/3b.md": "0edf2491d21e57c06824eded4a0129b26bb91c2ff4aac47684d1e00a7bf82132",
    "discovery/questions/4.md": "230ee63020e1737f998d695cab0789cf4165a117d0948a0e708dac55f4d859ba",
    "discovery/questions/5.md": "7bc45faf6f1266b48b726043482e19232ef056202cc03e87965ff8e2db8c0caf",
    "discovery/questions/6.md": "4f3a9e41287f29e68d3b0f3004b3a17cdc8d32df22d5c948b7ebc23059c998dc",
    "discovery/questions/7.md": "b38b67cf94a409cc8979d8c299a261b1a434fdd59aef18169f5f4d7554744ea5",
    "discovery/raw/impact.json": "fe209049e39e3fda42cb55a4cca0d672be2823d3aef9ce335ac06413d196521a",
    "discovery/raw/q1.json": "2968ca60ab9a2b262ca6fbe66cee92ddbb30691baf7098541148da5bf8c1237d",
    "discovery/raw/q2.json": "93224708303b8dfb489e49f4d4f36d76c6c845956c584e0e18f427244fd71320",
    "discovery/raw/q3-first-attempt.invalid.jsonl": "c70c0c728ee628ad9e2868faf228a34a6bce0a684b5c8832dd922babfa5f67e0",
    "discovery/raw/q3b.json": "00c6ed8922a942bb8521c833f59efbe01688ce366bc90d6064c4b0d334758980",
    "discovery/raw/q4.json": "bd5810eb10acae122438cf3abb01cabbc868a4244d5264c7cf870a96f8ee989d",
    "discovery/raw/q5.json": "ed859bcaf2599ac75eece31678edf69a049cb48c1519fcee8143f135a563673c",
    "discovery/raw/q6.json": "6afe91ffcb0ecc42c30f351e2a6799831a1dc299c354a76f0726a2a9db19a109",
    "discovery/raw/q7.json": "4ef900b038d26759f5324ec8a4917376ebb4a9c3f49b843b62470efab9981a63",
    "discovery/round-1.md": "2dfcc6f34ff2495e7e744e2a8eaf59c4acf817923412c8c0fb0687f590cfb195",
    "discovery/round-2.md": "6bf2d5554e3a56e6f827ce28eaee8842a8ef7583402141e3d3072084e9d6ffda",
    "gate.json": "90893f46180b1b67dbe506246fef9b64096170c43644a5ea99fb0cc12d5583ab",
    "impl/be-writer.C3a/result.json": "4976067abdae0a2db151ae17aea14bf5f9c1a98921705eb0b7a22da43dc08160",
    "impl/be-writer.C3b/result.json": "6488b1716fadae6354419139025e7b2008195d9e4bff8480675c7773e0027df4",
    "impl/test-designer-sighted.C4b/result.json": "9193eadf000f9ed86bc6bd739e0162e271ea5e46bf0b25a3cd765f29aef86df7",
    "impl/test-designer.C2/result.json": "5c0816ae5b36b7d232122b254f13636b817d052f3740976b1727d3925f409956",
    "journal.jsonl": "816b8b4e0a8b3a5e34f1423981d8021a6f1f6d2ddb9924591c09a0f1a7258447",
    "prompts/be-writer-behaviour.json": "8eb46f53a8d21c3ca63c762c825a616c2a22ddaad885d9199b4edda3552661c6",
    "prompts/be-writer-behaviour.md": "50bb11285435892e2f832bf0e5bcde9ad78749d61b2a4282c65327fe8768777d",
    "prompts/be-writer-skeleton.json": "ca0ed69ef61a68089d11780f662183cdf57a90566fb1d6dfb2841dcdc4cdfecd",
    "prompts/be-writer-skeleton.md": "9bb8c85b062b37cfd8a6fc1eeaa879618c5f11c2c7ffb98bd810e350bb0fb25b",
    "prompts/code-researcher.1.json": "9d30241a71a0c85ec5882fd8515355397ad3920781b938a1ff5304e5be86ba7c",
    "prompts/code-researcher.1.md": "bf65bb055ba3d3e42711139b1987674d0bee93fbf019936589157494f0d08961",
    "prompts/code-researcher.2.json": "a35e7d8f98cec1f296d5df6758cc37f3fae1962a42390441e1467b01d1cec020",
    "prompts/code-researcher.2.md": "da6f37339e65039f92e1a00e941eed623d601ae577f9ca7a85b381685fcc7a34",
    "prompts/code-researcher.3.json": "d8272d12f6d3c047804c85c10c06ecad4412b83773a7e3edf8602c7d3d593125",
    "prompts/code-researcher.3.md": "65109a3f6ebce180fe9852a275d78fd51c9167b5359111d31281c452f8dcea88",
    "prompts/code-researcher.3b.json": "45ab3cf1bec8988dc2a6fe8bf6fe9de80db30010fb92949c74d635ff027acfae",
    "prompts/code-researcher.3b.md": "4811e4470439e001cb7858a10c0d7e9c32e899fb442226bf7991e0e5bb6a5997",
    "prompts/code-researcher.4.json": "4b8bdd5eaab7b1051f1d2310c481dd3f1f8fcc17a57d37e9a9f29b5aff7f08ad",
    "prompts/code-researcher.4.md": "1b552100cf6e551aca7d58630fa0d3fa1cb6b7f9a71c8e7ca3e5282786482357",
    "prompts/code-researcher.5.json": "f0f74e346de084a46a8dcda00a372e7be73497f24c5f0ccd9aa4129df5581ee6",
    "prompts/code-researcher.5.md": "ac40d43d1cf76078d218903e20ca25f29b831c1f26dac91be34c97e179f7b539",
    "prompts/code-researcher.6.json": "f0aec6d0e5d3091811d730075579183f7e3e71a80aa1eb9a07c4df03846fa109",
    "prompts/code-researcher.6.md": "528202e4fcb88665ac39e7d5bc082f5e2e976cd95c3116655346c99c20527851",
    "prompts/code-researcher.7.json": "c1d2e4b8e4331c1f9ff096387d80858edc209080a35be80ec60fa8ba46497e4f",
    "prompts/code-researcher.7.md": "acd27bc49b218e43e1a74d6d67427f6eb4304097f98d6850d129579f3ef215fa",
    "prompts/impact-analyst.json": "c537073b5a3a9b115545735dbf9ab6cec0b9464008a42d95805882e741920e5b",
    "prompts/impact-analyst.md": "502d7adee1981215a58dbcc00ece9212a994f720c94926716de5d54b658dd5e2",
    "prompts/test-designer-sighted.json": "af9afd29d5ed03ad1f387634eeef168b941f9711ecc15e7ccd58c971039369a2",
    "prompts/test-designer-sighted.md": "88250359ac33de2adb32f7b97750f8c51b87058cdec5ba03a4da184e80916b3a",
    "prompts/test-designer.json": "59f7be5f35a3a4c115325da29c28fdb948f49235f18b45a426ea693f3708876d",
    "prompts/test-designer.md": "6b0d3fb70d93533c37468e045f7adef4979075c0ad24d75dbb89cefaf00d344d",
    "skeleton-check.json": "bcf3e71f03143db0a525bc5577967b213c464b41761ff9d168ddde05aef4bd7e",
    "story.md": "c9591ad203cf439589ed0abf7a2578d5cc3336eb89a91a38e8a67f82a2970d19",
    "tests/red-first.json": "e84a95c389f692497cff32b98f474d5ac67d4bb1e0a8b9cfb11a7b0e49ca0222",
    "generated/swagger.base.json": "4ad8b820ca57f87cd41e331883f7a9951105a22d272fa9b1d805aef6423aa6eb",
    "generated/capability-map.json": "ef9341f9bd76df83af914e1bda2ba6c4d20f4cad1698fe971aae1bccb854048c",
    "generated/core-surface.json": "1c5ca522929db7f829ba60c35cb9066077118eff86bbd968b36798f8631f2945",
    "specs/spec.md": "ad2fb57f801052932cf738cf37f52e5519a7dad05a7d32dee4a7f11b0337f93b",
    "specs/plan.md": "a78fdf965a2523c2b0efafe30efba2b1294db10eb117de100fefd3db1b3bd4ce",
    "specs/tasks.md": "d79bef94c03ec11579fdad6cbecb2ab1224f4dc07c5c6ad3baea5cdde8b81484"
  },
  "acceptance_tests_hash": "4cb515f22134d04e1c037304a3c1f65a8c1446d948d687fdefc717193ba7f5ec",
  "rounds": {
    "C4": 0,
    "C5": 0
  },
  "open_items": {
    "decisions_open": [],
    "hard_list_assumptions_without_decision": [],
    "blockers": [],
    "disputes": [],
    "unspecified_behaviour": []
  },
  "tokens_spent": 0
}
